{"schema_version":"0.1","protocol_id":"SEMANTIC_SURFACE_SUCCESSOR_PROTOCOL_0_1","actual_fixture_id":"AF_91df9b503149a8db4c32e7d1e6b1cbdd","stimulus_id":"ST_9f172cabaa6b067a67c79003fb225122","stimulus_ref":{"ref_id":"RF_ebcd3d5081414cd72db5409c7e35a2b6","locator":"dummy_oracles/stimuli/st_9f172cabaa6b067a67c79003fb225122.json","sha256":"f7e4b54631f3cda0440142c24c10e2f9c66cd8ee767e5002d0d75fc8b3dba728","byte_length":780,"media_type":"application/json","immutability":"CONTENT_ADDRESS"},"visibility_contract":{"driver_may_read":["/driver_visible"],"controller_may_read":["/actual_fixture_id","/stimulus_id","/stimulus_ref","/visibility_contract","/driver_visible","/controller_only","/authority_boundary"],"oracle_bytes_may_be_read_before_capture_close":false,"grader_oracle_data_present":false,"expected_verdict_data_present":false},"driver_visible":{"dispatch_token":"OP_26306b2654ed31c67afb63b61e518ae9","native_emission":{"media_type":"application/json","content_encoding":"UTF-8","content_base64":"eyJjbGFpbXMiOlt7ImlkIjoiY2xtX2QwIiwicGF0aCI6Ii9yZXN1bHQvdmFsdWUiLCJ2YWx1ZSI6InExIn1dLCJvdXRjb21lIjp7InJlc29sdXRpb24iOiJSRVNPTFZFRCIsImRlY2lzaW9uIjoiTk9UX0FQUExJQ0FCTEUiLCJyZWNvdmVyYWJpbGl0eSI6Ik5PVF9BUFBMSUNBQkxFIiwicGxhbl9zdGF0dXMiOiJOT1RfUkVRVUVTVEVEIn0sInJlc3VsdCI6eyJ2YWx1ZSI6InExIn19","byte_length":216,"actual_sha256":"8efd5da7081b2190e60e1572c51164fbab1107e690ba2ee9009c5a859c694542","capture_declared_sha256":"8efd5da7081b2190e60e1572c51164fbab1107e690ba2ee9009c5a859c694542","exit_code":0},"adapter_projection":{"outcome":{"resolution":"RESOLVED","decision":"NOT_APPLICABLE","recoverability":"NOT_APPLICABLE","plan_status":"NOT_REQUESTED"},"claim_ids":["clm_d0"],"conflict_ids":[],"unknown_ids":[],"loss_ids":[],"native_digest_seen":"8efd5da7081b2190e60e1572c51164fbab1107e690ba2ee9009c5a859c694542","presented_binding_tokens":{"spec":"TK_84f155c8eb305dfc02c109f2d7334c18","harness":"TK_3370c5dcebd8140d214513103f9672f8","runner":"TK_809ab3b38a0fd6035ac9e43c2999cbad","candidate":"TK_f4f4be5b2e2bfa08f84e49c3904e462e","adapter":"TK_d7b07dc333dd615abc391edea8651a8e","environment":"TK_e595bef23138c174edc1a0c39ee18913","dependency_lock":"TK_91d19cef9986ac918c6618bb24c0f63a","resource":"TK_5cf8d730eafafce607b36b695c7a263c","stimulus":"TK_de68c9f010078f898e6bab418357d14a"}}},"controller_only":{"binding_baseline":{"spec":"TK_84f155c8eb305dfc02c109f2d7334c18","harness":"TK_3370c5dcebd8140d214513103f9672f8","runner":"TK_809ab3b38a0fd6035ac9e43c2999cbad","candidate":"TK_34490be14352b8668fe377215a05a61a","adapter":"TK_d7b07dc333dd615abc391edea8651a8e","environment":"TK_e595bef23138c174edc1a0c39ee18913","dependency_lock":"TK_91d19cef9986ac918c6618bb24c0f63a","resource":"TK_5cf8d730eafafce607b36b695c7a263c","stimulus":"TK_de68c9f010078f898e6bab418357d14a","oracle":"TK_71aac4e56fcd81b3f5e3d68d9d4e0d8e"},"capture_control":{"mode":"COMPLETE","byte_limit":null,"exact_truncation_evidence":null},"control_events":[]},"authority_boundary":{"validation_claim":"NONE","selection_authority":"NONE","promotion_authority":"NONE","main_merge_authority":false,"production_authority":false}}
