{"schema_version":"0.1","protocol_id":"SEMANTIC_SURFACE_SUCCESSOR_PROTOCOL_0_1","actual_fixture_id":"AF_b87159fc5df814014afaafc3e5b9cd4d","stimulus_id":"ST_5317211bf31e2121a627390e70718ceb","stimulus_ref":{"ref_id":"RF_2cf68191ed62e94b8396a01e7270536f","locator":"dummy_oracles/stimuli/st_5317211bf31e2121a627390e70718ceb.json","sha256":"4e59cc6678e3b3cbc26b7c99f269e8141ab387cb48d1a535628c2bee71b38a51","byte_length":780,"media_type":"application/json","immutability":"CONTENT_ADDRESS"},"visibility_contract":{"driver_may_read":["/driver_visible"],"controller_may_read":["/actual_fixture_id","/stimulus_id","/stimulus_ref","/visibility_contract","/driver_visible","/controller_only","/authority_boundary"],"oracle_bytes_may_be_read_before_capture_close":false,"grader_oracle_data_present":false,"expected_verdict_data_present":false},"driver_visible":{"dispatch_token":"OP_924fa8fe1f0b1f47dc33321d2d0fbc45","native_emission":{"media_type":"application/json","content_encoding":"UTF-8","content_base64":"eyJvdXRjb21lIjo=","byte_length":11,"actual_sha256":"c498f9b9e0ce6e84929eadbf946c68e9080a3743657e6365ab9b14b952260670","capture_declared_sha256":"c498f9b9e0ce6e84929eadbf946c68e9080a3743657e6365ab9b14b952260670","exit_code":0},"adapter_projection":null},"controller_only":{"binding_baseline":{"spec":"TK_84f155c8eb305dfc02c109f2d7334c18","harness":"TK_3370c5dcebd8140d214513103f9672f8","runner":"TK_809ab3b38a0fd6035ac9e43c2999cbad","candidate":"TK_34490be14352b8668fe377215a05a61a","adapter":"TK_d7b07dc333dd615abc391edea8651a8e","environment":"TK_e595bef23138c174edc1a0c39ee18913","dependency_lock":"TK_91d19cef9986ac918c6618bb24c0f63a","resource":"TK_5cf8d730eafafce607b36b695c7a263c","stimulus":"TK_de68c9f010078f898e6bab418357d14a","oracle":"TK_71aac4e56fcd81b3f5e3d68d9d4e0d8e"},"capture_control":{"mode":"COMPLETE","byte_limit":null,"exact_truncation_evidence":null},"control_events":[]},"authority_boundary":{"validation_claim":"NONE","selection_authority":"NONE","promotion_authority":"NONE","main_merge_authority":false,"production_authority":false}}
