{"schema_version":"0.1","protocol_id":"SEMANTIC_SURFACE_SUCCESSOR_PROTOCOL_0_1","actual_fixture_id":"AF_71b9b3a64905aba724b17f14131f583a","stimulus_id":"ST_694b98d7e6847e3f259b8e925ed219fd","stimulus_ref":{"ref_id":"RF_462f1b7f2e4d43b762fe1081867ce582","locator":"dummy_oracles/stimuli/st_694b98d7e6847e3f259b8e925ed219fd.json","sha256":"21eb7fa99de371308cddced7855a62a04a956ba7f1580b14b4ad8fd197c0e48a","byte_length":853,"media_type":"application/json","immutability":"CONTENT_ADDRESS"},"visibility_contract":{"driver_may_read":["/driver_visible"],"controller_may_read":["/actual_fixture_id","/stimulus_id","/stimulus_ref","/visibility_contract","/driver_visible","/controller_only","/authority_boundary"],"oracle_bytes_may_be_read_before_capture_close":false,"grader_oracle_data_present":false,"expected_verdict_data_present":false},"driver_visible":{"dispatch_token":"OP_049c8138bdfc6424faef65508d0c247a","native_emission":{"media_type":"application/json","content_encoding":"UTF-8","content_base64":"eyJsb3NzZXMiOlt7ImlkIjoibG9zc19jOSIsImtpbmQiOiJCWVRFIiwiZGV0YWlsIjoibGluZSBlbmRpbmcgcmVtb3ZlZCJ9XSwib3V0Y29tZSI6eyJyZXNvbHV0aW9uIjoiUkVTT0xWRUQiLCJkZWNpc2lvbiI6Ik5PVF9BUFBMSUNBQkxFIiwicmVjb3ZlcmFiaWxpdHkiOiJQQVJUSUFMIiwicGxhbl9zdGF0dXMiOiJOT1RfUkVRVUVTVEVEIn19","byte_length":195,"actual_sha256":"a7c32bb235fa98f3fa212a6dfe15e2f6a303fa76d431893203dde8a31633fe15","capture_declared_sha256":"a7c32bb235fa98f3fa212a6dfe15e2f6a303fa76d431893203dde8a31633fe15","exit_code":0},"adapter_projection":{"outcome":{"resolution":"RESOLVED","decision":"NOT_APPLICABLE","recoverability":"PARTIAL","plan_status":"NOT_REQUESTED"},"claim_ids":[],"conflict_ids":[],"unknown_ids":[],"loss_ids":[],"native_digest_seen":"a7c32bb235fa98f3fa212a6dfe15e2f6a303fa76d431893203dde8a31633fe15","presented_binding_tokens":{"spec":"TK_84f155c8eb305dfc02c109f2d7334c18","harness":"TK_3370c5dcebd8140d214513103f9672f8","runner":"TK_809ab3b38a0fd6035ac9e43c2999cbad","candidate":"TK_34490be14352b8668fe377215a05a61a","adapter":"TK_d7b07dc333dd615abc391edea8651a8e","environment":"TK_e595bef23138c174edc1a0c39ee18913","dependency_lock":"TK_91d19cef9986ac918c6618bb24c0f63a","resource":"TK_5cf8d730eafafce607b36b695c7a263c","stimulus":"TK_de68c9f010078f898e6bab418357d14a"}}},"controller_only":{"binding_baseline":{"spec":"TK_84f155c8eb305dfc02c109f2d7334c18","harness":"TK_3370c5dcebd8140d214513103f9672f8","runner":"TK_809ab3b38a0fd6035ac9e43c2999cbad","candidate":"TK_34490be14352b8668fe377215a05a61a","adapter":"TK_d7b07dc333dd615abc391edea8651a8e","environment":"TK_e595bef23138c174edc1a0c39ee18913","dependency_lock":"TK_91d19cef9986ac918c6618bb24c0f63a","resource":"TK_5cf8d730eafafce607b36b695c7a263c","stimulus":"TK_de68c9f010078f898e6bab418357d14a","oracle":"TK_71aac4e56fcd81b3f5e3d68d9d4e0d8e"},"capture_control":{"mode":"COMPLETE","byte_limit":null,"exact_truncation_evidence":null},"control_events":[]},"authority_boundary":{"validation_claim":"NONE","selection_authority":"NONE","promotion_authority":"NONE","main_merge_authority":false,"production_authority":false}}
