{"schema_version":"0.1","protocol_id":"SEMANTIC_SURFACE_SUCCESSOR_PROTOCOL_0_1","actual_fixture_id":"AF_5a4e2748c3e2c83f76564111d2bbc049","stimulus_id":"ST_9fcdcef311fe1432dbead85df79e97e8","stimulus_ref":{"ref_id":"RF_7a5f9611324ed9226d4c5bd890dda01c","locator":"dummy_oracles/stimuli/st_9fcdcef311fe1432dbead85df79e97e8.json","sha256":"db49f47cb762fc5228fb41b53d2a60efc0b1fc8f3c95219899b896b6961d0266","byte_length":780,"media_type":"application/json","immutability":"CONTENT_ADDRESS"},"visibility_contract":{"driver_may_read":["/driver_visible"],"controller_may_read":["/actual_fixture_id","/stimulus_id","/stimulus_ref","/visibility_contract","/driver_visible","/controller_only","/authority_boundary"],"oracle_bytes_may_be_read_before_capture_close":false,"grader_oracle_data_present":false,"expected_verdict_data_present":false},"driver_visible":{"dispatch_token":"OP_1d79429030e9f168a475024ab594ded8","native_emission":null,"adapter_projection":null},"controller_only":{"binding_baseline":{"spec":"TK_84f155c8eb305dfc02c109f2d7334c18","harness":"TK_3370c5dcebd8140d214513103f9672f8","runner":"TK_809ab3b38a0fd6035ac9e43c2999cbad","candidate":"TK_34490be14352b8668fe377215a05a61a","adapter":"TK_d7b07dc333dd615abc391edea8651a8e","environment":"TK_e595bef23138c174edc1a0c39ee18913","dependency_lock":"TK_91d19cef9986ac918c6618bb24c0f63a","resource":"TK_5cf8d730eafafce607b36b695c7a263c","stimulus":"TK_de68c9f010078f898e6bab418357d14a","oracle":"TK_71aac4e56fcd81b3f5e3d68d9d4e0d8e"},"capture_control":{"mode":"NO_CAPTURE","byte_limit":null,"exact_truncation_evidence":null},"control_events":[{"event_id":"CE_e0eb3ff7efecfcffddb4d50240cb3cc7","event_type":"ORACLE_ACCESS_CANARY_TRIGGERED","occurred_at":"2026-08-22T00:00:02Z","evidence_payload":{"media_type":"application/json","content_base64":"eyJldmVudCI6Ik9SQUNMRV9BQ0NFU1NfQ0FOQVJZX1RSSUdHRVJFRCIsInByaW5jaXBhbCI6IkRVTU1ZX0VYRUNVVElPTl9QUk9DRVNTIiwib3JhY2xlX2J5dGVzX2V4cG9zZWQiOmZhbHNlfQ==","byte_length":109,"sha256":"b6febf9e49569e193446efecc3787558b6ebc9a6356145d80d093d28555d2a77"}}]},"authority_boundary":{"validation_claim":"NONE","selection_authority":"NONE","promotion_authority":"NONE","main_merge_authority":false,"production_authority":false}}
