{"schema_version":"0.1","protocol_id":"SEMANTIC_SURFACE_SUCCESSOR_PROTOCOL_0_1","actual_fixture_id":"AF_44a0b27f317e095b4544c40080544749","stimulus_id":"ST_70c20c9a9c0282f4ee3333d5b464cf60","stimulus_ref":{"ref_id":"RF_b9c9da16a6f450b923b8d3387424551a","locator":"dummy_oracles/stimuli/st_70c20c9a9c0282f4ee3333d5b464cf60.json","sha256":"b1cc763fe9de5666c8c7b92d0c2853e30e9ccbd8bfcb729c6e34d9823e131e0f","byte_length":780,"media_type":"application/json","immutability":"CONTENT_ADDRESS"},"visibility_contract":{"driver_may_read":["/driver_visible"],"controller_may_read":["/actual_fixture_id","/stimulus_id","/stimulus_ref","/visibility_contract","/driver_visible","/controller_only","/authority_boundary"],"oracle_bytes_may_be_read_before_capture_close":false,"grader_oracle_data_present":false,"expected_verdict_data_present":false},"driver_visible":{"dispatch_token":"OP_5c9ef9dcffa849fcfb5afa9659151b1c","native_emission":null,"adapter_projection":null},"controller_only":{"binding_baseline":{"spec":"TK_84f155c8eb305dfc02c109f2d7334c18","harness":"TK_3370c5dcebd8140d214513103f9672f8","runner":"TK_809ab3b38a0fd6035ac9e43c2999cbad","candidate":"TK_34490be14352b8668fe377215a05a61a","adapter":"TK_d7b07dc333dd615abc391edea8651a8e","environment":"TK_e595bef23138c174edc1a0c39ee18913","dependency_lock":"TK_91d19cef9986ac918c6618bb24c0f63a","resource":"TK_5cf8d730eafafce607b36b695c7a263c","stimulus":"TK_de68c9f010078f898e6bab418357d14a","oracle":"TK_71aac4e56fcd81b3f5e3d68d9d4e0d8e"},"capture_control":{"mode":"NO_CAPTURE","byte_limit":null,"exact_truncation_evidence":null},"control_events":[{"event_id":"CE_103b29455f69f8c21b7e75e54fdb3fd9","event_type":"CONTROLLER_STOP","occurred_at":"2026-08-22T00:00:01Z","evidence_payload":{"media_type":"application/json","content_base64":"eyJldmVudCI6IkNPTlRST0xMRVJfU1RPUCIsInNvdXJjZSI6IkZST1pFTl9EVU1NWV9DT05UUk9MIn0=","byte_length":59,"sha256":"517bb5e0f455b470ee7ededafc8e11c4ac4f56b95b42e9284731881f0bf05425"}}]},"authority_boundary":{"validation_claim":"NONE","selection_authority":"NONE","promotion_authority":"NONE","main_merge_authority":false,"production_authority":false}}
