{"schema_version":"0.1","protocol_id":"SEMANTIC_SURFACE_SUCCESSOR_PROTOCOL_0_1","actual_fixture_id":"AF_4a70fa7fc14bebfb3cde7b83c8d46327","stimulus_id":"ST_21a844d38ac5b0b6b0e4b6c6e9e26be7","stimulus_ref":{"ref_id":"RF_26e90a744bceb65c221318cd2b8d1c3c","locator":"dummy_oracles/stimuli/st_21a844d38ac5b0b6b0e4b6c6e9e26be7.json","sha256":"e4a91d245cda33057225ed46ff5105733ede23c3d02ea0503480a25d96a83f79","byte_length":780,"media_type":"application/json","immutability":"CONTENT_ADDRESS"},"visibility_contract":{"driver_may_read":["/driver_visible"],"controller_may_read":["/actual_fixture_id","/stimulus_id","/stimulus_ref","/visibility_contract","/driver_visible","/controller_only","/authority_boundary"],"oracle_bytes_may_be_read_before_capture_close":false,"grader_oracle_data_present":false,"expected_verdict_data_present":false},"driver_visible":{"dispatch_token":"OP_314a64678953af89b70399a8b274773b","native_emission":{"media_type":"application/json","content_encoding":"UTF-8","content_base64":"eyJhY3Rpb24iOnsicG9zdHVyZSI6IlJFRlVTRSIsInJlYXNvbiI6ImRlZmF1bHQifSwib3V0Y29tZSI6eyJyZXNvbHV0aW9uIjoiUkVTT0xWRUQiLCJkZWNpc2lvbiI6IlJFRlVTRSIsInJlY292ZXJhYmlsaXR5IjoiTk9UX0FQUExJQ0FCTEUiLCJwbGFuX3N0YXR1cyI6Ik5PVF9SRVFVRVNURUQifX0=","byte_length":170,"actual_sha256":"307c869e9000093b4caa41f951913c235a3ad89014ca34004c380cde183dc094","capture_declared_sha256":"307c869e9000093b4caa41f951913c235a3ad89014ca34004c380cde183dc094","exit_code":0},"adapter_projection":{"outcome":{"resolution":"RESOLVED","decision":"REFUSE","recoverability":"NOT_APPLICABLE","plan_status":"NOT_REQUESTED"},"claim_ids":[],"conflict_ids":[],"unknown_ids":[],"loss_ids":[],"native_digest_seen":"307c869e9000093b4caa41f951913c235a3ad89014ca34004c380cde183dc094","presented_binding_tokens":{"spec":"TK_84f155c8eb305dfc02c109f2d7334c18","harness":"TK_3370c5dcebd8140d214513103f9672f8","runner":"TK_809ab3b38a0fd6035ac9e43c2999cbad","candidate":"TK_34490be14352b8668fe377215a05a61a","adapter":"TK_d7b07dc333dd615abc391edea8651a8e","environment":"TK_e595bef23138c174edc1a0c39ee18913","dependency_lock":"TK_91d19cef9986ac918c6618bb24c0f63a","resource":"TK_5cf8d730eafafce607b36b695c7a263c","stimulus":"TK_de68c9f010078f898e6bab418357d14a"}}},"controller_only":{"binding_baseline":{"spec":"TK_84f155c8eb305dfc02c109f2d7334c18","harness":"TK_3370c5dcebd8140d214513103f9672f8","runner":"TK_809ab3b38a0fd6035ac9e43c2999cbad","candidate":"TK_34490be14352b8668fe377215a05a61a","adapter":"TK_d7b07dc333dd615abc391edea8651a8e","environment":"TK_e595bef23138c174edc1a0c39ee18913","dependency_lock":"TK_91d19cef9986ac918c6618bb24c0f63a","resource":"TK_5cf8d730eafafce607b36b695c7a263c","stimulus":"TK_de68c9f010078f898e6bab418357d14a","oracle":"TK_71aac4e56fcd81b3f5e3d68d9d4e0d8e"},"capture_control":{"mode":"COMPLETE","byte_limit":null,"exact_truncation_evidence":null},"control_events":[]},"authority_boundary":{"validation_claim":"NONE","selection_authority":"NONE","promotion_authority":"NONE","main_merge_authority":false,"production_authority":false}}
