{"schema_version":"0.1","protocol_id":"SEMANTIC_SURFACE_SUCCESSOR_PROTOCOL_0_1","actual_fixture_id":"AF_44542b11f9f7bc8179512682868dc10c","stimulus_id":"ST_1fed5c9bbce6d4beb27d0dbfd622c9f8","stimulus_ref":{"ref_id":"RF_a0cf9b53a951258a748ce6dfa2fd411a","locator":"dummy_oracles/stimuli/st_1fed5c9bbce6d4beb27d0dbfd622c9f8.json","sha256":"819e891f247e78c7390b54108c1199bb639a1117f18942ba39f137cb456c9b91","byte_length":780,"media_type":"application/json","immutability":"CONTENT_ADDRESS"},"visibility_contract":{"driver_may_read":["/driver_visible"],"controller_may_read":["/actual_fixture_id","/stimulus_id","/stimulus_ref","/visibility_contract","/driver_visible","/controller_only","/authority_boundary"],"oracle_bytes_may_be_read_before_capture_close":false,"grader_oracle_data_present":false,"expected_verdict_data_present":false},"driver_visible":{"dispatch_token":"OP_94ee6f43405c48d3d42743c212210e1e","native_emission":{"media_type":"application/json","content_encoding":"UTF-8","content_base64":"eyJvdXRjb21lIjp7InJlc29sdXRpb24iOiJVTktOT1dOIiwiZGVjaXNpb24iOiJOT1RfQVBQTElDQUJMRSIsInJlY292ZXJhYmlsaXR5IjoiTk9UX0FQUExJQ0FCTEUiLCJwbGFuX3N0YXR1cyI6Ik5PVF9SRVFVRVNURUQifSwidW5rbm93bnMiOlt7ImlkIjoidW5rX2ExIiwicmVhc29uIjoibm9fYW5zd2VyIn1dfQ==","byte_length":178,"actual_sha256":"add51455d5948e752bc72ce26424198c86c8c4df63379afb99c33990d2e8f3f7","capture_declared_sha256":"add51455d5948e752bc72ce26424198c86c8c4df63379afb99c33990d2e8f3f7","exit_code":0},"adapter_projection":{"outcome":{"resolution":"UNKNOWN","decision":"NOT_APPLICABLE","recoverability":"NOT_APPLICABLE","plan_status":"NOT_REQUESTED"},"claim_ids":[],"conflict_ids":[],"unknown_ids":["unk_a1"],"loss_ids":[],"native_digest_seen":"add51455d5948e752bc72ce26424198c86c8c4df63379afb99c33990d2e8f3f7","presented_binding_tokens":{"spec":"TK_84f155c8eb305dfc02c109f2d7334c18","harness":"TK_3370c5dcebd8140d214513103f9672f8","runner":"TK_809ab3b38a0fd6035ac9e43c2999cbad","candidate":"TK_34490be14352b8668fe377215a05a61a","adapter":"TK_d7b07dc333dd615abc391edea8651a8e","environment":"TK_e595bef23138c174edc1a0c39ee18913","dependency_lock":"TK_91d19cef9986ac918c6618bb24c0f63a","resource":"TK_5cf8d730eafafce607b36b695c7a263c","stimulus":"TK_de68c9f010078f898e6bab418357d14a"}}},"controller_only":{"binding_baseline":{"spec":"TK_84f155c8eb305dfc02c109f2d7334c18","harness":"TK_3370c5dcebd8140d214513103f9672f8","runner":"TK_809ab3b38a0fd6035ac9e43c2999cbad","candidate":"TK_34490be14352b8668fe377215a05a61a","adapter":"TK_d7b07dc333dd615abc391edea8651a8e","environment":"TK_e595bef23138c174edc1a0c39ee18913","dependency_lock":"TK_91d19cef9986ac918c6618bb24c0f63a","resource":"TK_5cf8d730eafafce607b36b695c7a263c","stimulus":"TK_de68c9f010078f898e6bab418357d14a","oracle":"TK_71aac4e56fcd81b3f5e3d68d9d4e0d8e"},"capture_control":{"mode":"COMPLETE","byte_limit":null,"exact_truncation_evidence":null},"control_events":[]},"authority_boundary":{"validation_claim":"NONE","selection_authority":"NONE","promotion_authority":"NONE","main_merge_authority":false,"production_authority":false}}
