{"schema_version":"0.1","protocol_id":"SEMANTIC_SURFACE_SUCCESSOR_PROTOCOL_0_1","actual_fixture_id":"AF_26a333cbb972021a8afc97eaa490096c","stimulus_id":"ST_58ab78767a4ab10e094598e6dcf8d4a3","stimulus_ref":{"ref_id":"RF_34094474e0895747a1c258e4a7496f94","locator":"dummy_oracles/stimuli/st_58ab78767a4ab10e094598e6dcf8d4a3.json","sha256":"76fdddadca51d8021b7df013ef04c93c14c48d742e84985b3d45fdddf79cf27a","byte_length":893,"media_type":"application/json","immutability":"CONTENT_ADDRESS"},"visibility_contract":{"driver_may_read":["/driver_visible"],"controller_may_read":["/actual_fixture_id","/stimulus_id","/stimulus_ref","/visibility_contract","/driver_visible","/controller_only","/authority_boundary"],"oracle_bytes_may_be_read_before_capture_close":false,"grader_oracle_data_present":false,"expected_verdict_data_present":false},"driver_visible":{"dispatch_token":"OP_966cda3faf9f8b75de0402b4ca35242a","native_emission":{"media_type":"application/json","content_encoding":"UTF-8","content_base64":"eyJjb25mbGljdHMiOlt7ImlkIjoiY29uZl9iOCIsImNsYWltcyI6WyJyZWNfeDIiLCJyZWNfeTkiXX1dLCJvdXRjb21lIjp7InJlc29sdXRpb24iOiJDT05GTElDVCIsImRlY2lzaW9uIjoiTk9UX0FQUExJQ0FCTEUiLCJyZWNvdmVyYWJpbGl0eSI6Ik5PVF9BUFBMSUNBQkxFIiwicGxhbl9zdGF0dXMiOiJOT1RfUkVRVUVTVEVEIn19","byte_length":189,"actual_sha256":"cb04bd7fbfd5033e76fbb14225ee53191cf299d21f32af35f2d8426e4aa166f3","capture_declared_sha256":"cb04bd7fbfd5033e76fbb14225ee53191cf299d21f32af35f2d8426e4aa166f3","exit_code":0},"adapter_projection":{"outcome":{"resolution":"CONFLICT","decision":"NOT_APPLICABLE","recoverability":"NOT_APPLICABLE","plan_status":"NOT_REQUESTED"},"claim_ids":[],"conflict_ids":[],"unknown_ids":[],"loss_ids":[],"native_digest_seen":"cb04bd7fbfd5033e76fbb14225ee53191cf299d21f32af35f2d8426e4aa166f3","presented_binding_tokens":{"spec":"TK_84f155c8eb305dfc02c109f2d7334c18","harness":"TK_3370c5dcebd8140d214513103f9672f8","runner":"TK_809ab3b38a0fd6035ac9e43c2999cbad","candidate":"TK_34490be14352b8668fe377215a05a61a","adapter":"TK_d7b07dc333dd615abc391edea8651a8e","environment":"TK_e595bef23138c174edc1a0c39ee18913","dependency_lock":"TK_91d19cef9986ac918c6618bb24c0f63a","resource":"TK_5cf8d730eafafce607b36b695c7a263c","stimulus":"TK_de68c9f010078f898e6bab418357d14a"}}},"controller_only":{"binding_baseline":{"spec":"TK_84f155c8eb305dfc02c109f2d7334c18","harness":"TK_3370c5dcebd8140d214513103f9672f8","runner":"TK_809ab3b38a0fd6035ac9e43c2999cbad","candidate":"TK_34490be14352b8668fe377215a05a61a","adapter":"TK_d7b07dc333dd615abc391edea8651a8e","environment":"TK_e595bef23138c174edc1a0c39ee18913","dependency_lock":"TK_91d19cef9986ac918c6618bb24c0f63a","resource":"TK_5cf8d730eafafce607b36b695c7a263c","stimulus":"TK_de68c9f010078f898e6bab418357d14a","oracle":"TK_71aac4e56fcd81b3f5e3d68d9d4e0d8e"},"capture_control":{"mode":"COMPLETE","byte_limit":null,"exact_truncation_evidence":null},"control_events":[]},"authority_boundary":{"validation_claim":"NONE","selection_authority":"NONE","promotion_authority":"NONE","main_merge_authority":false,"production_authority":false}}
