{"schema_version":"0.1","protocol_id":"SEMANTIC_SURFACE_SUCCESSOR_PROTOCOL_0_1","actual_fixture_id":"AF_861238b43149ef53c2de84ff8f1ded57","stimulus_id":"ST_3e780756c06afaa10e1ae15b06830532","stimulus_ref":{"ref_id":"RF_d78e796ec7b4890bdab43b741cbd79e7","locator":"dummy_oracles/stimuli/st_3e780756c06afaa10e1ae15b06830532.json","sha256":"e0417da42b26512d1a95ef39466dfcdd797fef57bd7612cc57b19d1a811f4a82","byte_length":780,"media_type":"application/json","immutability":"CONTENT_ADDRESS"},"visibility_contract":{"driver_may_read":["/driver_visible"],"controller_may_read":["/actual_fixture_id","/stimulus_id","/stimulus_ref","/visibility_contract","/driver_visible","/controller_only","/authority_boundary"],"oracle_bytes_may_be_read_before_capture_close":false,"grader_oracle_data_present":false,"expected_verdict_data_present":false},"driver_visible":{"dispatch_token":"OP_03f05e9ae877f1f4089e9befa63f6955","native_emission":{"media_type":"application/json","content_encoding":"UTF-8","content_base64":"eyJjbGFpbXMiOlt7ImlkIjoiY2xtX2ExIiwicGF0aCI6Ii9yZXN1bHQvdmFsdWUiLCJ2YWx1ZSI6InYzIn1dLCJvdXRjb21lIjp7InJlc29sdXRpb24iOiJSRVNPTFZFRCIsImRlY2lzaW9uIjoiTk9UX0FQUExJQ0FCTEUiLCJyZWNvdmVyYWJpbGl0eSI6Ik5PVF9BUFBMSUNBQkxFIiwicGxhbl9zdGF0dXMiOiJOT1RfUkVRVUVTVEVEIn0sInJlc3VsdCI6eyJ2YWx1ZSI6InYzIn19","byte_length":216,"actual_sha256":"24be3c09428c2ec36676a7ef86c049f4ef37c927400a8bfb507fb4c7a102e0e6","capture_declared_sha256":"24be3c09428c2ec36676a7ef86c049f4ef37c927400a8bfb507fb4c7a102e0e6","exit_code":0},"adapter_projection":{"outcome":{"resolution":"RESOLVED","decision":"NOT_APPLICABLE","recoverability":"NOT_APPLICABLE","plan_status":"NOT_REQUESTED"},"claim_ids":["clm_a1"],"conflict_ids":[],"unknown_ids":[],"loss_ids":[],"native_digest_seen":"24be3c09428c2ec36676a7ef86c049f4ef37c927400a8bfb507fb4c7a102e0e6","presented_binding_tokens":{"spec":"TK_84f155c8eb305dfc02c109f2d7334c18","harness":"TK_3370c5dcebd8140d214513103f9672f8","runner":"TK_809ab3b38a0fd6035ac9e43c2999cbad","candidate":"TK_34490be14352b8668fe377215a05a61a","adapter":"TK_d7b07dc333dd615abc391edea8651a8e","environment":"TK_e595bef23138c174edc1a0c39ee18913","dependency_lock":"TK_91d19cef9986ac918c6618bb24c0f63a","resource":"TK_5cf8d730eafafce607b36b695c7a263c","stimulus":"TK_de68c9f010078f898e6bab418357d14a"}}},"controller_only":{"binding_baseline":{"spec":"TK_84f155c8eb305dfc02c109f2d7334c18","harness":"TK_3370c5dcebd8140d214513103f9672f8","runner":"TK_809ab3b38a0fd6035ac9e43c2999cbad","candidate":"TK_34490be14352b8668fe377215a05a61a","adapter":"TK_d7b07dc333dd615abc391edea8651a8e","environment":"TK_e595bef23138c174edc1a0c39ee18913","dependency_lock":"TK_91d19cef9986ac918c6618bb24c0f63a","resource":"TK_5cf8d730eafafce607b36b695c7a263c","stimulus":"TK_de68c9f010078f898e6bab418357d14a","oracle":"TK_71aac4e56fcd81b3f5e3d68d9d4e0d8e"},"capture_control":{"mode":"COMPLETE","byte_limit":null,"exact_truncation_evidence":null},"control_events":[]},"authority_boundary":{"validation_claim":"NONE","selection_authority":"NONE","promotion_authority":"NONE","main_merge_authority":false,"production_authority":false}}
