{"schema_version":"0.1","protocol_id":"SEMANTIC_SURFACE_SUCCESSOR_PROTOCOL_0_1","actual_fixture_id":"AF_00d1efdc0a4d465e1bb61161d06d7244","stimulus_id":"ST_8dab6646317210c8dc149dd3607bdf97","stimulus_ref":{"ref_id":"RF_5f69a646eaf10257407df918256e9a50","locator":"dummy_oracles/stimuli/st_8dab6646317210c8dc149dd3607bdf97.json","sha256":"75ff08bc2eae9661ef092a7175ed66f231e7d8de601fbf057c79ca407eeb101a","byte_length":780,"media_type":"application/json","immutability":"CONTENT_ADDRESS"},"visibility_contract":{"driver_may_read":["/driver_visible"],"controller_may_read":["/actual_fixture_id","/stimulus_id","/stimulus_ref","/visibility_contract","/driver_visible","/controller_only","/authority_boundary"],"oracle_bytes_may_be_read_before_capture_close":false,"grader_oracle_data_present":false,"expected_verdict_data_present":false},"driver_visible":{"dispatch_token":"OP_97e0dc051725a11691db03dbb823aeb1","native_emission":{"media_type":"application/json","content_encoding":"UTF-8","content_base64":"eyJjbGFpbXMiOlt7ImlkIjoiY2xtX3Q0IiwicGF0aCI6Ii9yZXN1bHQvdmFsdWUiLCJ2YWx1ZSI6InAyIn1dLCJvdXRjb21lIjp7InJlc29sdXRpb24iOiJSRVNPTFZFRCIsImRlY2lzaW9uIjoiTk9UX0FQUExJQ0FCTEUiLCJyZWNvdmVyYWJpbGl0eSI6Ik5PVF9BUFBMSUNBQkxFIiwicGxhbl9zdGF0dXMiOiJOT1RfUkVRVUVTVEVEIn0sInJlc3VsdCI6eyJ2YWx1ZSI6InAyIn19","byte_length":216,"actual_sha256":"7e13a6e2f29fc79a08f7fdc70e6a8427114f78463986da1e6e816c8414ddae0d","capture_declared_sha256":"7e13a6e2f29fc79a08f7fdc70e6a8427114f78463986da1e6e816c8414ddae0d","exit_code":0},"adapter_projection":null},"controller_only":{"binding_baseline":{"spec":"TK_84f155c8eb305dfc02c109f2d7334c18","harness":"TK_3370c5dcebd8140d214513103f9672f8","runner":"TK_809ab3b38a0fd6035ac9e43c2999cbad","candidate":"TK_34490be14352b8668fe377215a05a61a","adapter":"TK_d7b07dc333dd615abc391edea8651a8e","environment":"TK_e595bef23138c174edc1a0c39ee18913","dependency_lock":"TK_91d19cef9986ac918c6618bb24c0f63a","resource":"TK_5cf8d730eafafce607b36b695c7a263c","stimulus":"TK_de68c9f010078f898e6bab418357d14a","oracle":"TK_71aac4e56fcd81b3f5e3d68d9d4e0d8e"},"capture_control":{"mode":"TRUNCATE_AT_BYTE_LIMIT","byte_limit":64,"exact_truncation_evidence":{"reason":"BYTE_LIMIT","configured_limit_bytes":64,"original_byte_length":216,"original_sha256":"7e13a6e2f29fc79a08f7fdc70e6a8427114f78463986da1e6e816c8414ddae0d","captured_prefix_base64":"eyJjbGFpbXMiOlt7ImlkIjoiY2xtX3Q0IiwicGF0aCI6Ii9yZXN1bHQvdmFsdWUiLCJ2YWx1ZSI6InAyIn1dLA==","captured_prefix_byte_length":64,"captured_prefix_sha256":"bb926943604faa52954cd9ee50dffff247025bb6fbae8ddd4c041d30c09f7bb1"}},"control_events":[{"event_id":"CE_3942dc2aa2451236a0c2073bdf199196","event_type":"CAPTURE_LIMIT_APPLIED","occurred_at":"2026-08-22T00:00:03Z","evidence_payload":{"media_type":"application/json","content_base64":"eyJldmVudCI6IkNBUFRVUkVfTElNSVRfQVBQTElFRCIsImNvbmZpZ3VyZWRfbGltaXRfYnl0ZXMiOjY0LCJzb3VyY2UiOiJGUk9aRU5fRFVNTVlfQ09OVFJPTCJ9","byte_length":93,"sha256":"424f30174803a9e497c11cd4887389558e3b433b68c94505a16a82ff0fa72165"}}]},"authority_boundary":{"validation_claim":"NONE","selection_authority":"NONE","promotion_authority":"NONE","main_merge_authority":false,"production_authority":false}}
