{"schema_version":"0.1","protocol_id":"SEMANTIC_SURFACE_SUCCESSOR_PROTOCOL_0_1","actual_fixture_id":"AF_7edecc51741de73453fe1465264f0f95","stimulus_id":"ST_39f073f9c738fbb26f877e8254ac0c77","stimulus_ref":{"ref_id":"RF_63eebe31c6a7bd3a6ee26201a54fe06b","locator":"dummy_oracles/stimuli/st_39f073f9c738fbb26f877e8254ac0c77.json","sha256":"8a16cf7fa18bf41fccfe40e22b3cc3995ca7362626088f6fbcf4101958658af9","byte_length":780,"media_type":"application/json","immutability":"CONTENT_ADDRESS"},"visibility_contract":{"driver_may_read":["/driver_visible"],"controller_may_read":["/actual_fixture_id","/stimulus_id","/stimulus_ref","/visibility_contract","/driver_visible","/controller_only","/authority_boundary"],"oracle_bytes_may_be_read_before_capture_close":false,"grader_oracle_data_present":false,"expected_verdict_data_present":false},"driver_visible":{"dispatch_token":"OP_0cedb570bdeb20a649cb19471594ab57","native_emission":{"media_type":"application/json","content_encoding":"UTF-8","content_base64":"eyJjb25mbGljdHMiOlt7ImlkIjoiY29uZl9hMSIsImNsYWltcyI6WyJwNCIsInA0X2FsdCJdfV0sIm91dGNvbWUiOnsicmVzb2x1dGlvbiI6IkNPTkZMSUNUIiwiZGVjaXNpb24iOiJOT1RfQVBQTElDQUJMRSIsInJlY292ZXJhYmlsaXR5IjoiTk9UX0FQUExJQ0FCTEUiLCJwbGFuX3N0YXR1cyI6Ik5PVF9SRVFVRVNURUQifX0=","byte_length":185,"actual_sha256":"30641e0352e6394bf3800f2a0d82d76f15de18a4a6e4b779043be5630b8de590","capture_declared_sha256":"30641e0352e6394bf3800f2a0d82d76f15de18a4a6e4b779043be5630b8de590","exit_code":0},"adapter_projection":{"outcome":{"resolution":"CONFLICT","decision":"NOT_APPLICABLE","recoverability":"NOT_APPLICABLE","plan_status":"NOT_REQUESTED"},"claim_ids":[],"conflict_ids":["conf_a1"],"unknown_ids":[],"loss_ids":[],"native_digest_seen":"30641e0352e6394bf3800f2a0d82d76f15de18a4a6e4b779043be5630b8de590","presented_binding_tokens":{"spec":"TK_84f155c8eb305dfc02c109f2d7334c18","harness":"TK_3370c5dcebd8140d214513103f9672f8","runner":"TK_809ab3b38a0fd6035ac9e43c2999cbad","candidate":"TK_34490be14352b8668fe377215a05a61a","adapter":"TK_d7b07dc333dd615abc391edea8651a8e","environment":"TK_e595bef23138c174edc1a0c39ee18913","dependency_lock":"TK_91d19cef9986ac918c6618bb24c0f63a","resource":"TK_5cf8d730eafafce607b36b695c7a263c","stimulus":"TK_de68c9f010078f898e6bab418357d14a"}}},"controller_only":{"binding_baseline":{"spec":"TK_84f155c8eb305dfc02c109f2d7334c18","harness":"TK_3370c5dcebd8140d214513103f9672f8","runner":"TK_809ab3b38a0fd6035ac9e43c2999cbad","candidate":"TK_34490be14352b8668fe377215a05a61a","adapter":"TK_d7b07dc333dd615abc391edea8651a8e","environment":"TK_e595bef23138c174edc1a0c39ee18913","dependency_lock":"TK_91d19cef9986ac918c6618bb24c0f63a","resource":"TK_5cf8d730eafafce607b36b695c7a263c","stimulus":"TK_de68c9f010078f898e6bab418357d14a","oracle":"TK_71aac4e56fcd81b3f5e3d68d9d4e0d8e"},"capture_control":{"mode":"COMPLETE","byte_limit":null,"exact_truncation_evidence":null},"control_events":[]},"authority_boundary":{"validation_claim":"NONE","selection_authority":"NONE","promotion_authority":"NONE","main_merge_authority":false,"production_authority":false}}
